closing_criterion,status
Clean inputs from notebook 01 were loaded and validated.,completed
The forecasting grain was validated as date + store_nbr + family.,completed
"Historical trend, seasonality, stores, families, promotions, holidays, oil, transactions, and anomalies were analyzed.",completed
Business findings were summarized with modeling implications.,completed
Candidate variables for future modeling were documented.,completed
Analytical risks before feature engineering were documented.,completed
EDA outputs were saved under reports/eda_business_analysis.,completed
